{
  "$schema": "https://json-schema.org/draft/2020-12/schema",
  "$id": "https://barelysmash.dev/schemas/decision/1.0.0/decision.schema.json",
  "title": "Decision",
  "description": "The contract between BarelySmash intelligence engines and every downstream consumer. Specified in architecture/decision-object.md.",
  "type": "object",
  "additionalProperties": false,
  "required": [
    "schema_version",
    "decision_id",
    "source",
    "source_version",
    "domain",
    "category",
    "priority",
    "confidence",
    "summary",
    "evidence",
    "recommendations",
    "created_at"
  ],
  "properties": {
    "schema_version": {
      "description": "Semver of the Decision specification this object conforms to.",
      "type": "string",
      "pattern": "^\\d+\\.\\d+\\.\\d+$"
    },
    "decision_id": {
      "description": "Globally unique identifier. 'dec_' followed by a 26-character ULID.",
      "type": "string",
      "pattern": "^dec_[0-9A-HJKMNP-TV-Z]{26}$"
    },
    "source": {
      "description": "The engine that produced this Decision. JARVIS is never a valid source.",
      "type": "string",
      "enum": ["atlas", "friday"]
    },
    "source_version": {
      "description": "Semver of the engine build that produced this Decision. Required for reproducibility.",
      "type": "string",
      "pattern": "^\\d+\\.\\d+\\.\\d+$"
    },
    "domain": {
      "description": "Subdomain inside the engine that reasoned about this. Lowercase snake_case.",
      "type": "string",
      "pattern": "^[a-z][a-z0-9_]*$",
      "maxLength": 64
    },
    "category": {
      "description": "Engine-namespaced decision category. Registry lives in glossary/.",
      "type": "string",
      "pattern": "^(atlas|friday)\\.[a-z][a-z0-9_]*$",
      "maxLength": 64
    },
    "priority": {
      "description": "Cost of acting late. Not magnitude of impact.",
      "type": "string",
      "enum": ["critical", "high", "medium", "low"]
    },
    "confidence": {
      "description": "Estimated probability that the underlying insight holds. 0.30 is the emission floor.",
      "type": "number",
      "minimum": 0.3,
      "maximum": 1.0
    },
    "summary": {
      "description": "One imperative sentence. Lands verbatim in the Executive Brief.",
      "type": "string",
      "minLength": 1,
      "maxLength": 140
    },
    "rationale": {
      "description": "Two to four sentences connecting evidence to recommendation. Expected for critical and high priority.",
      "type": "string",
      "maxLength": 1200
    },
    "evidence": {
      "description": "The Observations supporting this Decision. A Decision with no evidence is an opinion.",
      "type": "array",
      "minItems": 1,
      "items": { "$ref": "#/$defs/evidenceItem" }
    },
    "recommendations": {
      "description": "Proposed courses of action.",
      "type": "array",
      "minItems": 1,
      "items": { "$ref": "#/$defs/recommendation" }
    },
    "requires_approval": {
      "description": "Whether a human must approve before any Action executes. Defaults to true.",
      "type": "boolean",
      "default": true
    },
    "supersedes": {
      "description": "The decision_id this Decision replaces. Must share source and category.",
      "type": "string",
      "pattern": "^dec_[0-9A-HJKMNP-TV-Z]{26}$"
    },
    "tags": {
      "description": "Free-form filtering labels. Nothing may depend on a tag for correctness.",
      "type": "array",
      "uniqueItems": true,
      "items": {
        "type": "string",
        "pattern": "^[a-z0-9][a-z0-9-]*$",
        "maxLength": 32
      }
    },
    "created_at": {
      "description": "When the engine emitted this Decision. RFC 3339, UTC, Z suffix.",
      "type": "string",
      "format": "date-time",
      "pattern": "Z$"
    },
    "expires_at": {
      "description": "When this Decision stops being actionable. Must be later than created_at.",
      "type": "string",
      "format": "date-time",
      "pattern": "Z$"
    }
  },
  "$defs": {
    "evidenceItem": {
      "type": "object",
      "additionalProperties": false,
      "required": ["observation_id", "statement"],
      "properties": {
        "observation_id": {
          "description": "Trace back to the Observation record. 'obs_' followed by a 26-character ULID.",
          "type": "string",
          "pattern": "^obs_[0-9A-HJKMNP-TV-Z]{26}$"
        },
        "statement": {
          "description": "The observation in plain language. Factual, no interpretation.",
          "type": "string",
          "minLength": 1,
          "maxLength": 280
        },
        "metric": { "$ref": "#/$defs/metric" },
        "source_ref": {
          "description": "Pointer to the underlying record, report, or dataset.",
          "type": "string",
          "maxLength": 512
        }
      }
    },
    "metric": {
      "description": "Structured form of an observation, so applications can chart what JARVIS narrates.",
      "type": "object",
      "additionalProperties": false,
      "required": ["name", "value"],
      "properties": {
        "name": {
          "type": "string",
          "pattern": "^[a-z][a-z0-9_]*$",
          "maxLength": 64
        },
        "value": { "type": "number" },
        "unit": { "type": "string", "maxLength": 32 },
        "delta": {
          "description": "Change over the stated period, as a fraction. 0.12 is a 12% increase.",
          "type": "number"
        },
        "period": {
          "description": "ISO 8601 duration the metric covers, e.g. P4W, P1D, PT1H.",
          "type": "string",
          "pattern": "^P(?!$)(\\d+Y)?(\\d+M)?(\\d+W)?(\\d+D)?(T(?=\\d)(\\d+H)?(\\d+M)?(\\d+S)?)?$"
        }
      }
    },
    "recommendation": {
      "type": "object",
      "additionalProperties": false,
      "required": ["recommendation_id", "statement"],
      "properties": {
        "recommendation_id": {
          "type": "string",
          "pattern": "^rec_[0-9A-HJKMNP-TV-Z]{26}$"
        },
        "statement": {
          "description": "Imperative. What to do.",
          "type": "string",
          "minLength": 1,
          "maxLength": 280
        },
        "action_type": {
          "description": "Names an executable Action the application supports. Absent means advisory only.",
          "type": "string",
          "pattern": "^[a-z][a-z0-9_]*$",
          "maxLength": 64
        },
        "parameters": {
          "description": "Arguments for the named Action.",
          "type": "object"
        },
        "reversible": {
          "description": "Whether the Action can be undone. Defaults to false deliberately.",
          "type": "boolean",
          "default": false
        },
        "estimated_impact": {
          "type": "object",
          "additionalProperties": false,
          "required": ["value", "direction"],
          "properties": {
            "value": { "type": "number" },
            "unit": { "type": "string", "maxLength": 32 },
            "direction": {
              "type": "string",
              "enum": ["increase", "decrease", "neutral"]
            },
            "horizon": {
              "description": "ISO 8601 duration over which the impact is expected.",
              "type": "string",
              "pattern": "^P(?!$)(\\d+Y)?(\\d+M)?(\\d+W)?(\\d+D)?(T(?=\\d)(\\d+H)?(\\d+M)?(\\d+S)?)?$"
            }
          }
        }
      },
      "dependentRequired": {
        "parameters": ["action_type"]
      }
    }
  }
}
